<!DOCTYPE airframe SYSTEM "../airframe.dtd">

<airframe name="ardrone2_oa_avoid">

  <firmware name="rotorcraft">
    <target name="ap" board="ardrone2">
      <configure name="USE_BARO_BOARD" value="TRUE"/>
    </target>

    <define name="FAILSAFE_DESCENT_SPEED" value="0.5"/>
    <define name="USE_SONAR" value="FALSE"/>
 <define name="USE_GPS_ALT" value="1"/>

    <configure name="USE_MAGNETOMETER" value="TRUE"/>

	<!-- Subsystem section -->
    <module name="telemetry" type="transparent_udp"/>
    <module name="radio_control" type="datalink"/>
    <module name="motor_mixing"/>
    <module name="actuators" type="ardrone2"/>
    <module name="imu" type="ardrone2"/>
 <module name="gps" type="datalink"/>
    <module name="stabilization" type="int_quat"/>
    <module name="ahrs" type="int_cmpl_quat"/>
    <module name="ins" type="extended"/>
  </firmware>

  <modules main_freq="512">
    <module name="bat_voltage_ardrone2"/>
    <module name="stereocam">
	<configure name="STEREO_UART" value="UART1"/>
	<configure name="STEREO_BAUD" value="B115200"/>
    </module>
    <module name="stereocam_follow_me"/>
  </modules>

  <commands>
    <axis name="PITCH" failsafe_value="0"/>
    <axis name="ROLL" failsafe_value="0"/>
    <axis name="YAW" failsafe_value="0"/>
    <axis name="THRUST" failsafe_value="3000"/>
  </commands>

  <servos driver="Default">
    <servo name="TOP_LEFT" no="0" min="0" neutral="1" max="500"/>
    <servo name="TOP_RIGHT" no="1" min="0" neutral="1" max="500"/>
    <servo name="BOTTOM_RIGHT" no="2" min="0" neutral="1" max="500"/>
    <servo name="BOTTOM_LEFT" no="3" min="0" neutral="1" max="500"/>
  </servos>

  <section name="MIXING" prefix="MOTOR_MIXING_">
    <define name="TRIM_ROLL" value="0"/>
    <define name="TRIM_PITCH" value="0"/>
    <define name="TRIM_YAW" value="0"/>

    <!-- Time cross layout (X), with order NW (CW), NE (CCW), SE (CW), SW (CCW) -->
    <define name="TYPE" value="QUAD_X"/>
  </section>

  <command_laws>
    <call fun="motor_mixing_run(autopilot_motors_on,FALSE,values)"/>
    <set servo="TOP_LEFT" value="motor_mixing.commands[MOTOR_FRONT_LEFT]"/>
    <set servo="TOP_RIGHT" value="motor_mixing.commands[MOTOR_FRONT_RIGHT]"/>
    <set servo="BOTTOM_RIGHT" value="motor_mixing.commands[MOTOR_BACK_RIGHT]"/>
    <set servo="BOTTOM_LEFT" value="motor_mixing.commands[MOTOR_BACK_LEFT]"/>
  </command_laws>

  <section name="IMU" prefix="IMU_">
    <!-- Accelero -->
    <define name="ACCEL_X_NEUTRAL" value="2048"/>
    <define name="ACCEL_Y_NEUTRAL" value="2048"/>
    <define name="ACCEL_Z_NEUTRAL" value="2048"/>

    <!-- Magneto calibration -->
    <define name="MAG_X_NEUTRAL" value="0"/>
    <define name="MAG_Y_NEUTRAL" value="0"/>
    <define name="MAG_Z_NEUTRAL" value="-180"/>
    <define name="MAG_X_SENS" value="16." integer="16"/>
    <define name="MAG_Y_SENS" value="16." integer="16"/>
    <define name="MAG_Z_SENS" value="16." integer="16"/>

    <!-- Magneto current calibration -->
    <define name="MAG_X_CURRENT_COEF" value="0.0"/>
    <define name="MAG_Y_CURRENT_COEF" value="0.0"/>
    <define name="MAG_Z_CURRENT_COEF" value="0.0"/>

    <define name="BODY_TO_IMU_PHI" value="-2.3" unit="deg"/>
    <define name="BODY_TO_IMU_THETA" value="1.7" unit="deg"/>
    <define name="BODY_TO_IMU_PSI" value="0." unit="deg"/>
  </section>

  <!-- local magnetic field -->
  <!-- http://wiki.paparazziuav.org/wiki/Subsystem/ahrs#Local_Magnetic_Field -->
  <section name="AHRS" prefix="AHRS_">
    <!-- Delft -->
    <define name="H_X" value="0.3892503"/>
    <define name="H_Y" value="0.0017972"/>
    <define name="H_Z" value="0.9211303"/>
  </section>

  <section name="INS" prefix="INS_">
  </section>


  <section name="STABILIZATION_ATTITUDE_INDI" prefix="STABILIZATION_INDI_">
    <!-- control effectiveness -->
    <define name="G1_P" value="0.028551973"/>
    <define name="G1_Q" value="0.023775417"/>
    <define name="G1_R" value="0.00173069"/>
    <define name="G2_R" value="0.086460732"/>

    <!-- reference acceleration for attitude control -->
    <define name="REF_ERR_P" value="380.0"/>
    <define name="REF_ERR_Q" value="380.0"/>
    <define name="REF_ERR_R" value="70.0"/>
    <define name="REF_RATE_P" value="21.6"/>
    <define name="REF_RATE_Q" value="21.6"/>
    <define name="REF_RATE_R" value="11.0"/>

    <!-- second order filter parameters -->
    <define name="FILT_OMEGA" value="20.0"/>
    <define name="FILT_ZETA" value="0.55"/>
    <define name="FILT_OMEGA_R" value="20.0"/>
    <define name="FILT_ZETA_R" value="0.55"/>

    <!-- first order actuator dynamics -->
    <define name="ACT_DYN_P" value="0.06"/>
    <define name="ACT_DYN_Q" value="0.06"/>
    <define name="ACT_DYN_R" value="0.06"/>

    <!-- Adaptive Learning Rate -->
    <define name="USE_ADAPTIVE" value="FALSE"/>
    <define name="ADAPTIVE_MU" value="0.0001"/>
  </section>
  <section name="STABILIZATION_ATTITUDE" prefix="STABILIZATION_ATTITUDE_">
    <!-- setpoints -->
    <define name="SP_MAX_PHI" value="45" unit="deg"/>
    <define name="SP_MAX_THETA" value="45" unit="deg"/>
    <define name="SP_MAX_R" value="180" unit="deg/s"/>
    <define name="DEADBAND_A" value="0"/>
    <define name="DEADBAND_E" value="0"/>
    <define name="DEADBAND_R" value="250"/>

    <!-- reference -->
    <define name="REF_OMEGA_P" value="450" unit="deg/s"/>
    <define name="REF_ZETA_P" value="0.9"/>
    <define name="REF_MAX_P" value="600." unit="deg/s"/>
    <define name="REF_MAX_PDOT" value="RadOfDeg(8000.)"/>

    <define name="REF_OMEGA_Q" value="450" unit="deg/s"/>
    <define name="REF_ZETA_Q" value="0.9"/>
    <define name="REF_MAX_Q" value="600." unit="deg/s"/>
    <define name="REF_MAX_QDOT" value="RadOfDeg(8000.)"/>

    <define name="REF_OMEGA_R" value="450" unit="deg/s"/>
    <define name="REF_ZETA_R" value="0.9"/>
    <define name="REF_MAX_R" value="600." unit="deg/s"/>
    <define name="REF_MAX_RDOT" value="RadOfDeg(8000.)"/>

  <!-- feedback -->
    <define name="PHI_PGAIN" value="850"/>
    <define name="PHI_DGAIN" value="425"/>
    <define name="PHI_IGAIN" value="0"/>

    <define name="THETA_PGAIN" value="850"/>
    <define name="THETA_DGAIN" value="425"/>
    <define name="THETA_IGAIN" value="0"/>

    <define name="PSI_PGAIN" value="1000"/>
    <define name="PSI_DGAIN" value="700"/>
    <define name="PSI_IGAIN" value="0"/>

    <!-- feedforward -->
    <define name="PHI_DDGAIN" value="0"/>
    <define name="THETA_DDGAIN" value="0"/>
    <define name="PSI_DDGAIN" value="100"/>
  </section>

  <section name="GUIDANCE_V" prefix="GUIDANCE_V_">
    <define name="HOVER_KP" value="583"/>
    <define name="HOVER_KD" value="82"/>
    <define name="HOVER_KI" value="13"/>
    <define name="NOMINAL_HOVER_THROTTLE" value="0.645"/>
    <define name="ADAPT_THROTTLE_ENABLED" value="false"/>
  </section>


  <section name="GUIDANCE_H" prefix="GUIDANCE_H_">
    <!-- Good weather -->
    <define name="MAX_BANK" value="20" unit="deg"/>
    <!-- Bad weather -->
    <!-- define name="MAX_BANK" value="32" unit="deg"/ -->

    <define name="PGAIN" value="363"/>
    <define name="DGAIN" value="237"/>
    <define name="IGAIN" value="30"/>
    <define name="VGAIN" value="0"/>
    <define name="AGAIN" value="0"/>
  </section>

  <section name="SIMULATOR" prefix="NPS_">
    <define name="ACTUATOR_NAMES" value="nw_motor, ne_motor, se_motor, sw_motor" type="string[]"/>
    <define name="JSBSIM_MODEL" value="simple_ardrone2" type="string"/>
    <define name="JSBSIM_INIT" value="reset00" type="string"/>
    <define name="SENSORS_PARAMS" value="nps_sensors_params_ardrone2.h" type="string"/>
  </section>

  <section name="AUTOPILOT">
    <define name="MODE_STARTUP" value="AP_MODE_NAV"/>
    <define name="MODE_MANUAL" value="AP_MODE_ATTITUDE_DIRECT"/>
    <define name="MODE_AUTO1" value="AP_MODE_HOVER_Z_HOLD"/>
    <define name="MODE_AUTO2" value="AP_MODE_NAV"/>
    <define name="ARRIVED_AT_WAYPOINT" value="0.15"/>
    <define name="AUTOPILOT_IN_FLIGHT_MIN_THRUST" value="1500"/>
    <define name="NO_RC_THRUST_LIMIT" value="TRUE"/>
  </section>

  <section name="BAT">
    <define name="MILLIAMP_AT_FULL_THROTTLE" value="8700"/>
    <define name="CATASTROPHIC_BAT_LEVEL" value="9.3" unit="V"/>
    <define name="CRITIC_BAT_LEVEL" value="9.9" unit="V"/>
    <define name="LOW_BAT_LEVEL" value="10.1" unit="V"/>
    <define name="MAX_BAT_LEVEL" value="12.4" unit="V"/>
  </section>
</airframe>
