<!DOCTYPE airframe SYSTEM "../airframe.dtd">

<airframe name="Matek H7 FW HITL">

  <description>
    Mateksys FC H743 SLIM Fixedwing HITL
  </description>

  <firmware name="fixedwing">
    <configure name="PERIODIC_FREQUENCY" value="100"/>
    <configure name="USE_HARD_FAULT_RECOVERY" value="FALSE"/>

    <target name="ap" board="matek_h743_slim">
    </target>

    <target name="nps" board="pc">
      <module name="fdm" type="jsbsim"/>
    </target>

    <module name="radio_control" type="datalink"/>
    <module name="telemetry" type="transparent">
      <configure name="MODEM_PORT" value="usb_serial"/>
    </module>

    <module name="control" type="new"/>
    <module name="navigation"/>

    <configure name="HITL_PORT" value="usb_serial_debug"/>
    <module name="sensors" type="hitl">
      <define name="USE_BATTERY_MONITOR"/>
    </module>
    <module name="actuators" type="hitl"/>

    <!--module name="ahrs" type="float_dcm"/>
    <module name="ins" type="alt_float"/-->
    <module name="ins" type="float_invariant">
      <configure name="AHRS_PROPAGATE_FREQUENCY" value="100"/>
      <configure name="AHRS_CORRECT_FREQUENCY" value="100"/>
    </module>

    <module name="sys_mon"/>
    <module name="air_data"/>
  </firmware>

  <firmware name="generic_hitl">
    <target name="hitl" board="pc">
      <configure name="USE_HARD_FAULT_RECOVERY" value="FALSE"/>
      <module name="fdm" type="jsbsim"/>
      <module name="nps" type="hitl_sensors">
        <define name="AP_DEV" value="/dev/pprz-dbg" type="string"/>
      </module>
    </target>
  </firmware>

  <!-- commands section -->
  <!-- Servo Configuration -->
  <servos>
    <servo name="THROTTLE"	    no="5" min="1100" neutral="1100" max="1900"/>
    <servo name="AILERON_RIGHT" no="1" min="900" neutral="1500" max="2100"/>
    <servo name="AILERON_LEFT"	no="2" min="2100" neutral="1500" max="900"/>
    <servo name="ELEVATOR"      no="3" min="975" neutral="1500" max="2100"/>
    <servo name="RUDDER"        no="4" min="2100" neutral="1500" max="900"/>
  </servos>

  <!-- Servo Command Structure -->
  <commands>
    <axis name="THROTTLE"   failsafe_value="0"/>
    <axis name="ROLL"       failsafe_value="0"/>
    <axis name="PITCH"      failsafe_value="0"/>
    <axis name="YAW"        failsafe_value="0"/>
  </commands>

  <!-- RC Command Structure -->
  <rc_commands>
    <set command="THROTTLE" value="@THROTTLE"/>
    <set command="ROLL"     value="@ROLL"/>
    <set command="PITCH"    value="@PITCH"/>
    <set command="YAW"	    value="@YAW"/>
  </rc_commands>

  <!-- Define RC commands to Servo in Auto Mode -->
  <auto_rc_commands>
    <set command="YAW"  value="@YAW"/>
  </auto_rc_commands>

  <!-- Define Mixing Parameters -->
  <section name="MIXER">
    <define name="AILERON_AILERON_RATE" value="0.9"/>
    <define name="ELEV_ELEV_RATE" value="0.8"/>
  </section>

  <!-- Define RC commands to Servos in Manual -->
  <command_laws>
    <let var="aileron" value="@ROLL * AILERON_AILERON_RATE"/>
    <let var="elevator" value="@PITCH * ELEV_ELEV_RATE"/>

    <set servo="THROTTLE"       value="@THROTTLE"/>
    <set servo="AILERON_RIGHT"  value="$aileron"/>  <!--flip signs if necessary -->
    <set servo="AILERON_LEFT"   value=" - $aileron"/>
    <set servo="ELEVATOR"       value="$elevator"/>
    <set servo="RUDDER"         value="@YAW"/>
  </command_laws>

  <!-- Define Max Roll and Pitch setpoints in Auto1 -->
  <section name="AUTO1" prefix="AUTO1_">
    <define name="MAX_ROLL" value="0.7"/>
    <define name="MAX_PITCH" value="0.6"/>
  </section>

  <section name="IMU" prefix="IMU_">
    <define name="BODY_TO_IMU_PHI"   value="0." unit="deg"/>
    <define name="BODY_TO_IMU_THETA" value="0." unit="deg"/>
    <define name="BODY_TO_IMU_PSI"   value="0." unit="deg"/>

    <!-- Dummy Mag values for NPS -
         replace with your own calibration -->
    <define name="MAG_X_NEUTRAL" value="0"/>
    <define name="MAG_Y_NEUTRAL" value="0"/>
    <define name="MAG_Z_NEUTRAL" value="0"/>
  </section>

  <include href="conf/mag/toulouse_muret.xml"/>

  <section name="INS" prefix="INS_">
    <define name="ROLL_NEUTRAL_DEFAULT"  value="0" unit="deg"/>
    <define name="PITCH_NEUTRAL_DEFAULT" value="0" unit="deg"/>
  </section>


  <!-- Define current estimator and Battery Level Warnings -->
  <section name="BAT">
    <!-- Simulator values -->
    <define name="MAX_BAT_LEVEL" value="5.0" unit="V" />
    <define name="LOW_BAT_LEVEL" value="4.0" unit="V"/>
    <define name="CRITIC_BAT_LEVEL" value="3.5" unit="V"/>
    <define name="CATASTROPHIC_BAT_LEVEL" value="3.0" unit="V"/>
  </section>

  <section name="MISC">
    <define name="NOMINAL_AIRSPEED"   value="16."     unit="m/s"/> <!-- GCS only -->
    <define name="CARROT"             value="5."  unit="s"/>   <!-- GCS only -->
    <define name="KILL_MODE_DISTANCE"   value="(1.5*MAX_DIST_FROM_HOME)"/>
    <define name="DEFAULT_CIRCLE_RADIUS" value="120."/>
  </section>

  <section name="VERTICAL CONTROL" prefix="V_CTL_">
    <!-- outer loop proportional gain -->
    <define name="ALTITUDE_PGAIN" value="0.136"/>
    <!-- outer loop saturation -->
    <define name="ALTITUDE_MAX_CLIMB" value="3."/>

    <!-- auto throttle inner loop -->
    <define name="AUTO_THROTTLE_NOMINAL_CRUISE_THROTTLE" value="0.65"/>
    <define name="AUTO_THROTTLE_MIN_CRUISE_THROTTLE" value="0.20"/>
    <define name="AUTO_THROTTLE_MAX_CRUISE_THROTTLE" value="0.80"/>
    <define name="AUTO_PITCH_MAX_PITCH" value="20." unit="deg"/>
    <define name="AUTO_PITCH_MIN_PITCH" value="-20." unit="deg"/>

    <!-- Climb loop (throttle) -->
    <define name="AUTO_THROTTLE_CLIMB_THROTTLE_INCREMENT" value="0.1" unit="%/(m/s)"/>
    <define name="AUTO_THROTTLE_PGAIN" value="0.006"/>
    <define name="AUTO_THROTTLE_DGAIN" value="0.0"/>
    <define name="AUTO_THROTTLE_IGAIN" value="0.035"/>
    <define name="AUTO_THROTTLE_PITCH_OF_VZ_PGAIN" value="0.09"/>

    <!-- Climb loop (pitch) -->
    <define name="AUTO_PITCH_PGAIN" value="0.027"/>
    <define name="AUTO_PITCH_DGAIN" value="0.01"/>
    <define name="AUTO_PITCH_IGAIN" value="0.0"/>

    <!-- airspeed control -->
    <define name="AUTO_AIRSPEED_SETPOINT" value="16."/>
    <define name="AUTO_AIRSPEED_THROTTLE_PGAIN" value="0.1"/>
    <define name="AUTO_AIRSPEED_THROTTLE_DGAIN" value="0.12"/>
    <define name="AUTO_AIRSPEED_THROTTLE_IGAIN" value="0.0"/>
    <define name="AUTO_AIRSPEED_PITCH_PGAIN" value="0.06"/>
    <define name="AUTO_AIRSPEED_PITCH_DGAIN" value="0.0"/>
    <define name="AUTO_AIRSPEED_PITCH_IGAIN" value="0.042"/>
    <define name="AIRSPEED_MAX" value="30" unit="m/s"/>
    <define name="AIRSPEED_MIN" value="10" unit="m/s"/>

    <!-- groundspeed control -->
    <define name="AUTO_GROUNDSPEED_SETPOINT" value="15" unit="m/s"/>
    <define name="AUTO_GROUNDSPEED_PGAIN" value="1."/>
    <define name="AUTO_GROUNDSPEED_IGAIN" value="0."/>

    <!-- pitch trim -->
    <define name="PITCH_LOITER_TRIM" value="0." unit="deg"/>
    <define name="PITCH_DASH_TRIM" value="0." unit="deg"/>

    <define name="THROTTLE_SLEW" value="0.1"/>
  </section>

  <section name="HORIZONTAL CONTROL" prefix="H_CTL_">
    <define name="COURSE_PGAIN" value="1.135"/>
    <define name="COURSE_DGAIN" value="0.35"/>
    <define name="ROLL_MAX_SETPOINT" value="0.6" unit="rad"/>
    <define name="PITCH_MAX_SETPOINT" value="0.35" unit="rad"/>
    <define name="PITCH_MIN_SETPOINT" value="-0.2" unit="rad"/>

    <define name="PITCH_PGAIN" value="10000."/>
    <define name="PITCH_DGAIN" value="1500"/>
    <define name="PITCH_IGAIN" value="500"/>
     
    <define name="ROLL_ATTITUDE_GAIN" value="9000"/>
    <define name="ROLL_RATE_GAIN" value="1600"/>
    <define name="ROLL_IGAIN" value="100."/>

    <define name="PITCH_OF_ROLL" value="1." unit="deg"/>
    <define name="AILERON_OF_THROTTLE" value="0.0"/>
  </section>

  <section name="AGGRESSIVE" prefix="AGR_">
    <define name="BLEND_START" value="20"/><!-- Altitude Error to Initiate Aggressive Climb CANNOT BE ZERO!!-->
    <define name="BLEND_END" value="10"/><!-- Altitude Error to Blend Aggressive to Regular Climb Modes  CANNOT BE ZERO!!-->
    <define name="CLIMB_THROTTLE" value="0.85"/><!-- Gaz for Aggressive Climb -->
    <define name="CLIMB_PITCH" value="0.13"/><!-- Pitch for Aggressive Climb -->
    <define name="DESCENT_THROTTLE" value="0.1"/><!-- Gaz for Aggressive Decent -->
    <define name="DESCENT_PITCH" value="-0.1"/><!-- Pitch for Aggressive Decent -->
    <define name="CLIMB_NAV_RATIO" value="0.8"/><!-- Percent Navigation for Altitude Error Equal to Start Altitude -->
    <define name="DESCENT_NAV_RATIO" value="1.0"/>
  </section>

  <section name="FAILSAFE" prefix="FAILSAFE_">
    <define name="DELAY_WITHOUT_GPS" value="5" unit="s"/>
    <define name="DEFAULT_THROTTLE" value="0" unit="%"/>
    <define name="DEFAULT_ROLL" value="0.3" unit="rad"/>
    <define name="DEFAULT_PITCH" value="0.5" unit="rad"/>
    <define name="HOME_RADIUS" value="100" unit="m"/>
  </section>

  <section name="SIMULATOR" prefix="NPS_">
    <define name="JSBSIM_LAUNCHSPEED" value="15"/>
    <define name="JSBSIM_MODEL" value="easystar" type="string"/>
    <define name="JS_AXIS_MODE" value="4"/>
  </section>

</airframe>
