<!DOCTYPE airframe SYSTEM "../../airframe.dtd">

<airframe name="octIR">

  <description>
    * Autopilot:   TawakiV2
    * Actuators:   4 in 1  
    * Telemetry:   datalink
    * GPS:         datalink
    * RC:          datalink
  </description>

  <firmware name="rotorcraft">
    <configure name="RTOS_DEBUG" value="FALSE"/>
    <configure name="PERIODIC_FREQUENCY" value="500"/>
    <configure name="AHRS_PROPAGATE_FREQUENCY" value="$(PERIODIC_FREQUENCY)"/>

    <target name="ap" board="tawaki_2.0">
      <module name="radio_control" type="sbus"/>
      <define name="RADIO_KILL_SWITCH" value="RADIO_GAIN1"/>

      <configure name="BARO_PERIODIC_FREQUENCY" value="50"/>

      <configure name="ACCEL_AAF" value="126"/>
      <configure name="GYRO_AAF" value="441"/>
    </target>

    <target name="nps" board="pc">
      <module name="fdm" type="jsbsim"/>
      <module name="radio_control" type="ppm"/>
      <define name="TAWAKIV2_IMU_ROT" value=""/>
      <define name="TAWAKIV2_MAG_ROT" value=""/>
    </target>
    
    <module name="board" type="tawaki_2.0"/>
    
    <module name="telemetry" type="xbee_api"/>


    <module name="actuators" type="dshot">
      <configure name="DSHOT_BIDIR" value="FALSE"/>
    </module>

    <module name="gps" type="ublox">
      <configure name="UBX_GPS_BAUD" value="B230400"/>
    </module>

    <module name="stabilization" type="indi"/>
    <module name="guidance" type="indi"/>

    <module name="ins" type="ekf2">
      <configure name="USE_ALT_LLA_WAYPOINTS" value="FALSE"/>
      <define name="INS_EKF2_FORCE_NAV_REF" value="TRUE"/>
    </module>
    <!--module name="ins" type="ext_pose"/-->

    <module name="flight_recorder"/>
    <module name="logger_control_effectiveness">
      <define name="LOGGER_CONTROL_EFFECTIVENESS_ACTUATORS" value="TRUE"/>
    </module>

    <module name="thermal_ctl">
      <configure name="EXTRA_DL_PORT" value="UART3"/>
      <configure name="EXTRA_DL_BAUD" value="B115200"/>
    </module>

  </firmware>

  <servos driver="DShot">
    <servo name="FR" no="3" min="0" neutral="100" max="2000"/>
    <servo name="BR" no="4" min="0" neutral="100" max="2000"/>
    <servo name="BL" no="1" min="0" neutral="100" max="2000"/>
    <servo name="FL" no="2" min="0" neutral="100" max="2000"/>
  </servos>

  <commands>
    <axis name="FR" failsafe_value="MOTOR_STOP"/>
    <axis name="BR" failsafe_value="MOTOR_STOP"/>
    <axis name="BL" failsafe_value="MOTOR_STOP"/>
    <axis name="FL" failsafe_value="MOTOR_STOP"/>
    <axis name="THRUST" failsafe_value="0"/>
  </commands>

  <command_laws>
    <set servo="FR" value="@FR"/>
    <set servo="BR" value="@BR"/>
    <set servo="BL" value="@BL"/>
    <set servo="FL" value="@FL"/>
  </command_laws>

  <section name="IMU" prefix="IMU_">
    <define name="ACCEL_CALIB" type="array">
      <field type="struct">
        <field name="abi_id" value="24"/>
        <field name="calibrated" type="struct">
          <field name="neutral" value="true"/>
          <field name="scale_f" value="true"/>
          <field name="rotation" value="true"/>
        </field>
        <field name="neutral" value="-5,6,14" type="int[]"/>
        <field name="scale_f" value="{ 2.4470, 2.4541, 2.4551 }"/>
        <field value="TAWAKIV2_IMU_ROT"/>
      </field>
    </define>
    <define name="GYRO_CALIB" type="array">
      <field type="struct">
        <field name="abi_id" value="24"/>
        <field name="calibrated" type="struct">
          <field name="neutral" value="false"/>
          <field name="scale" value="false"/>
          <field name="rotation" value="true"/>
        </field>
        <field value="TAWAKIV2_IMU_ROT"/>
      </field>
    </define>
    <define name="MAG_CALIB" type="array">
      <field type="struct">
        <field name="abi_id" value="3"/>
        <field name="calibrated" type="struct">
          <field name="neutral" value="true"/>
          <field name="scale_f" value="true"/>
          <field name="rotation" value="true"/>
        </field>
        <field name="neutral" value="-2677,3223,-3142" type="int[]"/>
        <field name="scale_f" value="{ 0.6654, 0.6802, 0.6746 }"/>
        <field value="TAWAKIV2_MAG_ROT"/>
      </field>
    </define>

    <define name="BODY_TO_IMU_PHI" value="0." unit="deg"/>
    <define name="BODY_TO_IMU_THETA" value="0." unit="deg"/>
    <define name="BODY_TO_IMU_PSI" value="180." unit="deg"/>
  </section>

  <section name="STABILIZATION_ATTITUDE" prefix="STABILIZATION_ATTITUDE_">
    <!-- setpoint limits for attitude stabilization rc flight -->
    <define name="SP_MAX_PHI" value="45" unit="deg"/>
    <define name="SP_MAX_THETA" value="45" unit="deg"/>
    <define name="SP_MAX_R" value="60" unit="deg/s"/>
    <define name="DEADBAND_A" value="0"/>
    <define name="DEADBAND_E" value="0"/>
    <define name="DEADBAND_R" value="50"/>
  </section>

  <section name="STABILIZATION_ATTITUDE_INDI" prefix="STABILIZATION_INDI_">
    <define name="NUM_ACT" value="4"/>
    <!-- reference acceleration for attitude control -->
    <define name="REF_ERR_P" value="120"/>
    <define name="REF_ERR_Q" value="120"/>
    <define name="REF_ERR_R" value="120"/>
    <define name="REF_RATE_P" value="17"/>
    <define name="REF_RATE_Q" value="17"/>
    <define name="REF_RATE_R" value="10"/>
    <define name="MAX_R" value="45" unit="deg/s"/>

    <!-- second order filter parameters -->
    <define name="FILT_CUTOFF" value="4.0"/>
    <define name="FILT_CUTOFF_R" value="4.0"/>

    <!-- Adaptive Learning Rate -->
    <define name="USE_ADAPTIVE" value="FALSE"/>
    <define name="ADAPTIVE_MU" value="0.0001"/>

    <define name="COMMANDS" value="{COMMAND_FR, COMMAND_BR, COMMAND_BL, COMMAND_FL}"/>

    <!-- Full INDI -->
    <!-- control effectiveness -->
    <define name="G1" type="matrix">
      <field value="-30.42, -28.45, 31.37, 32.02" type="float[]"/>
      <field value="31.27, -25.46, -31.53, 27.11" type="float[]"/>
      <field value="1.98, -2.22, 1.48, -3.07" type="float[]"/>
      <field value="-1.27, -1.06, -0.83, -0.68" type="float[]"/>
    </define>
    <!--Counter torque effect of spinning up a rotor-->
    <define name="G2" value="{195.20, -249.16, 218.79, -178.50}"/>
    <!-- first order actuator dynamics -->
    <define name="ACT_FREQ" value="{13.6, 13.6, 13.6, 13.6}"/>
    <define name="ESTIMATION_FILT_CUTOFF" value="4.0"/>
    <!--Priority for each axis (roll, pitch, yaw and thrust)-->
    <define name="WLS_PRIORITIES" value="{1000, 1000, 1, 100}"/>
  </section>

  <section name="GUIDANCE_V" prefix="GUIDANCE_V_">
    <define name="REF_MIN_ZDD" value="-0.4*9.81"/>
    <define name="REF_MAX_ZDD" value=" 0.4*9.81"/>
    <define name="REF_MIN_ZD" value="-2."/>
    <define name="REF_MAX_ZD" value=" 2."/>
    <define name="NOMINAL_HOVER_THROTTLE" value="0.35"/>
  </section>

  <section name="GUIDANCE_H" prefix="GUIDANCE_H_">
    <define name="MAX_BANK" value="30" unit="deg"/>
    <define name="REF_MAX_SPEED" value="0.5"/>
    <define name="REF_MAX_ACCEL" value="2."/>
  </section>

  <section name="GUIDANCE_INDI" prefix="GUIDANCE_INDI_">
    <!--define name="POS_GAIN" value="0.8"/>
    <define name="SPEED_GAIN" value="1.4"/-->
  </section>

  <section name="NAV">
    <define name="ARRIVED_AT_WAYPOINT" value="0.6"/>
    <define name="NAV_CLIMB_VSPEED" value="0.8"/>
    <define name="NAV_DESCEND_VSPEED" value="-0.5"/>
  </section>

  <section name="BAT">
    <define name="CATASTROPHIC_BAT_LEVEL" value="6.4" unit="V"/>
    <define name="CRITIC_BAT_LEVEL" value="6.8" unit="V"/>
    <define name="LOW_BAT_LEVEL" value="7.2" unit="V"/>
    <define name="MAX_BAT_LEVEL" value="8.4" unit="V"/>
    <define name="BAT_NB_CELLS" value="2"/>
  </section>

  <section name="AUTOPILOT">
    <define name="MODE_STARTUP" value="AP_MODE_NAV"/>
    <define name="MODE_MANUAL" value="AP_MODE_ATTITUDE_DIRECT"/>
    <define name="MODE_AUTO1" value="AP_MODE_GUIDED"/>
    <define name="MODE_AUTO2" value="AP_MODE_NAV"/>
    <define name="FAILSAFE_FIXED_THROTTLE" value="0.1*MAX_PPRZ"/>
  </section>

  <section name="GCS">
    <define name="ALT_SHIFT_PLUS_PLUS" value="3"/>
    <define name="ALT_SHIFT_PLUS" value="1"/>
    <define name="ALT_SHIFT_MINUS" value="-0.5"/>
  </section>

  <section name="SIMULATOR" prefix="NPS_">
    <define name="ACTUATOR_NAMES" value="ne_motor, se_motor, sw_motor, nw_motor" type="string[]"/>
    <define name="JSBSIM_MODEL" value="simple_x_quad_ccw" type="string"/>
    <define name="COMMANDS_NB" value="4"/>
    <define name="NO_MOTOR_MIXING" value="TRUE"/>
  </section>

</airframe>
